{
  "$schema": "https://json-schema.org/draft/2020-12/schema",
  "title": "Rajasthan CET 12th Level Question",
  "type": "object",
  "additionalProperties": false,
  "required": [
    "id","exam","year","shift","subject","topic","difficulty",
    "question","options","correctAnswer","explanation","source","language"
  ],
  "properties": {
    "id": {"type":"string","minLength":1},
    "exam": {"type":"string","minLength":1},
    "year": {"type":"integer","minimum":2000},
    "shift": {"type":"string","minLength":1},
    "subject": {"type":"string","minLength":1},
    "topic": {"type":"string","minLength":1},
    "difficulty": {"type":"string","enum":["easy","medium","hard"]},
    "question": {"type":"string","minLength":1},
    "options": {"type":"array","minItems":4,"maxItems":4,"items":{"type":"string","minLength":1}},
    "correctAnswer": {"type":"integer","minimum":0,"maximum":3},
    "explanation": {"type":"string"},
    "source": {"type":"string","minLength":1},
    "language": {"type":"string","enum":["hi","en","hinglish"]}
  }
}
